{
 "schema": 1,
 "version": "2026.10.28.20",
 "updated": "2026-10-28T17:03:19+08:00",
 "note": "由 scripts/build_atlas.py 从 riskpairs.json + entries/ 生成，请勿手改",
 "riskpairs": [
  {
   "a": "債",
   "b": "償",
   "high": true,
   "note": "債項/債權證 vs 償付/清償/賠償 —— 实测主引擎系统性把「債」输出成「償」"
  },
  {
   "a": "逾",
   "b": "過",
   "high": true,
   "note": "超逾 vs 超過 —— 香港章程惯用「超逾」；同文档内两种都存在，禁全局替换"
  },
  {
   "a": "入",
   "b": "人",
   "high": true,
   "note": "入會/計入 vs 人材/任何人 —— 实测会两引擎同错，只能靠原图"
  },
  {
   "a": "記",
   "b": "託",
   "high": true,
   "note": "押記(charge) vs 委託 —— 错则改变法律性质"
  },
  {
   "a": "肯",
   "b": "苟",
   "high": true,
   "note": "中肯 vs 中苟 —— 核数报告用语"
  },
  {
   "a": "連",
   "b": "運",
   "high": true,
   "note": "關連(connected) vs 關運 —— 关连交易判定基准"
  },
  {
   "a": "註",
   "b": "注",
   "high": true,
   "note": "註冊 vs 注意 —— 简体混入高发"
  },
  {
   "a": "冊",
   "b": "册",
   "high": true,
   "note": "註冊處 vs 简体「册」"
  },
  {
   "a": "捐",
   "b": "損",
   "high": true,
   "note": "捐贈 vs 損害"
  },
  {
   "a": "予",
   "b": "子",
   "high": true,
   "note": "授予 vs 子"
  },
  {
   "a": "末",
   "b": "未",
   "high": true,
   "note": "末日 vs 未滿"
  },
  {
   "a": "己",
   "b": "已",
   "high": true,
   "note": "自己 vs 已經"
  },
  {
   "a": "藉",
   "b": "籍",
   "high": true,
   "note": "藉以 vs 籍貫"
  },
  {
   "a": "日",
   "b": "曰",
   "high": false
  },
  {
   "a": "土",
   "b": "士",
   "high": false
  },
  {
   "a": "干",
   "b": "千",
   "high": false
  },
  {
   "a": "戌",
   "b": "戍",
   "high": false
  },
  {
   "a": "巳",
   "b": "已",
   "high": false
  },
  {
   "a": "刺",
   "b": "剌",
   "high": false
  },
  {
   "a": "具",
   "b": "俱",
   "high": false
  },
  {
   "a": "幼",
   "b": "幻",
   "high": false
  },
  {
   "a": "折",
   "b": "拆",
   "high": false
  },
  {
   "a": "亨",
   "b": "享",
   "high": false
  },
  {
   "a": "侯",
   "b": "候",
   "high": false
  },
  {
   "a": "微",
   "b": "徽",
   "high": false
  },
  {
   "a": "查",
   "b": "杳",
   "high": false
  },
  {
   "a": "決",
   "b": "决",
   "high": false,
   "note": "异体字，多为远端引擎输出简体异体，通常不算错"
  },
  {
   "a": "內",
   "b": "内",
   "high": false,
   "note": "异体字"
  },
  {
   "a": "債",
   "b": "價",
   "high": false,
   "note": "債項 vs 價項 —— 同為亻旁，右半「責/賈」形近；除「償→債」外的第二變體"
  },
  {
   "a": "清",
   "b": "潰",
   "high": false,
   "note": "清盤 vs 潰盤 —— 法定程序名，誤識少見但後果重（潰盤不成詞）"
  },
  {
   "a": "黃",
   "b": "黄",
   "high": false,
   "note": "姓名高發，簡體形混入；同一表內常與「黃」並存"
  },
  {
   "a": "於",
   "b": "于",
   "high": false,
   "note": "介詞簡體形混入；但「于」可為姓氏，禁全局替換"
  }
 ],
 "entries": [
  {
   "id": "zhhant-charity-0001",
   "lang": "zh-Hant",
   "domain": "hkicharity",
   "wrong": "人",
   "right": "入",
   "contexts": [
    "入會贊助",
    "計入法定人數",
    "加入"
   ],
   "severity": "high",
   "occurrences": 2,
   "evidence": "原图 p4 1.9 作「入會贊助」；p13 作「計入法定人數」。字形判据：捺尾向右下为「人」，收笔向左下为「入」。注意此组会出现两引擎同错。",
   "case_doc": "香港華夏醫藥學會慈善基金有限公司 章程",
   "case_page": "4, 13",
   "reported_at": "2026-10-27",
   "reporter": "macm",
   "confirmed_by": "原图 8-12x 放大 + 同页 1.6「中醫人材」对照"
  },
  {
   "id": "zhhant-charity-0002",
   "lang": "zh-Hant",
   "domain": "hkicharity",
   "wrong": "注",
   "right": "註",
   "contexts": [
    "公司註冊證明書",
    "公司註冊處"
   ],
   "severity": "medium",
   "occurrences": 1,
   "evidence": "原图封面作「公司註冊證明書」，同页上一行为「公司註冊處」。属简体字形混入，非形近。",
   "case_doc": "香港華夏醫藥學會慈善基金有限公司 章程",
   "case_page": "1",
   "reported_at": "2026-10-27",
   "reporter": "macm"
  },
  {
   "id": "zhhant-charity-0003",
   "lang": "zh-Hant",
   "domain": "hkicharity",
   "wrong": "册",
   "right": "冊",
   "contexts": [
    "註冊",
    "註冊處"
   ],
   "severity": "medium",
   "occurrences": 1,
   "evidence": "同上。简体「册」不贯穿竖笔，「冊」贯穿。",
   "case_doc": "香港華夏醫藥學會慈善基金有限公司 章程",
   "case_page": "1",
   "reported_at": "2026-10-27",
   "reporter": "macm"
  },
  {
   "id": "zhhant-charity-0004",
   "lang": "zh-Hant",
   "domain": "hkicharity",
   "wrong": "託",
   "right": "記",
   "contexts": [
    "押記"
   ],
   "severity": "high",
   "occurrences": 1,
   "evidence": "原图 p5 1.18「可押記本公司現有或未來的財產」。押記(charge)为香港法定担保用语，误作「押託」改变法律性质。",
   "case_doc": "香港華夏醫藥學會慈善基金有限公司 章程",
   "case_page": "5",
   "reported_at": "2026-10-27",
   "reporter": "macm"
  },
  {
   "id": "zhhant-charity-0005",
   "lang": "zh-Hant",
   "domain": "hkicharity",
   "wrong": "苟",
   "right": "肯",
   "contexts": [
    "中肯地反映"
   ],
   "severity": "high",
   "occurrences": 1,
   "evidence": "原图 p6「真實而中肯地反映狀況」。核数报告标准用语。",
   "case_doc": "香港華夏醫藥學會慈善基金有限公司 章程",
   "case_page": "6",
   "reported_at": "2026-10-27",
   "reporter": "macm"
  },
  {
   "id": "zhhant-charity-0006",
   "lang": "zh-Hant",
   "domain": "hkicharity",
   "wrong": "過",
   "right": "逾",
   "contexts": [
    "不超逾",
    "超逾百分之一"
   ],
   "severity": "medium",
   "occurrences": 3,
   "evidence": "原图 p6 三处均作「超逾」。同文档另有「超過6個月」等 2 处确实为「超過」，不可全局替换，须按位置判。",
   "case_doc": "香港華夏醫藥學會慈善基金有限公司 章程",
   "case_page": "6",
   "reported_at": "2026-10-27",
   "reporter": "macm"
  },
  {
   "id": "zhhant-charity-0007",
   "lang": "zh-Hant",
   "domain": "hkicharity",
   "wrong": "償",
   "right": "債",
   "contexts": [
    "債項",
    "債項或義務",
    "債權證",
    "債權人"
   ],
   "severity": "high",
   "occurrences": 4,
   "evidence": "原图 p6/p13 三处「債項」、p15 一处「債權證」。注意同一文档中「償付/清償/彌償/賠償」的「償」均为正确用法，禁止全局替换。",
   "case_doc": "香港華夏醫藥學會慈善基金有限公司 章程",
   "case_page": "6, 13, 15",
   "reported_at": "2026-10-27",
   "reporter": "macm"
  },
  {
   "id": "zhhant-charity-0008",
   "lang": "zh-Hant",
   "domain": "hkicharity",
   "wrong": "價",
   "right": "債",
   "contexts": [
    "債權證"
   ],
   "severity": "high",
   "occurrences": 1,
   "evidence": "原图 p15「為本公司的債權證的持有人分開舉行的會議」。debenture 债权证。",
   "case_doc": "香港華夏醫藥學會慈善基金有限公司 章程",
   "case_page": "15",
   "reported_at": "2026-10-27",
   "reporter": "macm"
  },
  {
   "id": "zhhant-charity-0009",
   "lang": "zh-Hant",
   "domain": "hkicharity",
   "wrong": "運",
   "right": "連",
   "contexts": [
    "有關連的情況"
   ],
   "severity": "high",
   "occurrences": 1,
   "evidence": "原图 p23「與…有關連的情況下」。董事免责条款；關連(connected)为关连交易判定基准。",
   "case_doc": "香港華夏醫藥學會慈善基金有限公司 章程",
   "case_page": "23",
   "reported_at": "2026-10-27",
   "reporter": "macm"
  },
  {
   "id": "zhhant-charity-0010",
   "lang": "zh-Hant",
   "domain": "hkicharity",
   "wrong": "償項",
   "right": "債項",
   "contexts": [
    "清償一切債項及債務",
    "所訂約承擔的債項及債務",
    "就其債項或義務",
    "任何債項、債務、合約"
   ],
   "severity": "high",
   "occurrences": 11,
   "evidence": "同一固定条款（清盤分擔：「…支付清盤的費用…」）在 6 份公會章程中一致出现，回 600dpi 原图逐处核证，全部作「債項」（右半为「責」，非「賞」）：國際中醫針灸解剖學會 p2 ×2、香港中醫整脊學會 p3、香港中醫藥膳專業學會 p3/p9、香港廣西社團總會 p4、香港本草醫藥學會 p2、香港華夏醫藥學會慈善基金 p6/p13×2。禁止全局替换：同句中「清償」的「償」为正确用法。",
   "case_doc": "P015 中醫公會 23 份章程（國際中醫針灸解剖學會、香港中醫整脊學會、香港中醫藥膳專業學會、香港廣西社團總會、香港本草醫藥學會、香港華夏醫藥學會慈善基金）",
   "case_page": "p2 / p3 / p4 / p6 / p9 / p13",
   "reported_at": "2026-10-28",
   "reporter": "macm",
   "confirmed_by": "600dpi 重渲染 + 单字级裁切；同页用「清償」的「償」作反面对照"
  },
  {
   "id": "zhhant-charity-0011",
   "lang": "zh-Hant",
   "domain": "hkicharity",
   "wrong": "超過百分",
   "right": "超逾百分",
   "contexts": [
    "不超逾百分之一的資本",
    "控制不超逾百分之一的表決權",
    "年息率不超逾"
   ],
   "severity": "medium",
   "occurrences": 12,
   "evidence": "本批 5 份章程的「公司條例附表式」条款一律印作「超逾」：國際中醫針灸解剖學會 p2（2 处）、香港中藥藥劑師協會 p4（2 处+年息率 1 处）、香港廣西社團總會 p3（2 处）、香港華夏醫藥學會慈善基金 p6（2 处+年息率 1 处）、香港針灸醫師學會 p3（2 处）。600dpi 裁切显示该字右半为「俞＋刂」，非「咼」。反例：同批的九龍中醫師公會「不超過十元／百分之十二」、香港本草醫藥學會「不超過百分之一的表決權」经同法核证确为「超過」，故**绝不能全局替换**，须逐处判。判别经验：附表式条款（百分之一資本/表決權、年息率）用「超逾」，个别手写式金额与期限（十元、六個月）用「超過」。",
   "case_doc": "P015 中醫公會 23 份章程（國際中醫針灸解剖學會、香港中藥藥劑師協會、香港廣西社團總會、香港華夏醫藥學會慈善基金、香港針灸醫師學會）",
   "case_page": "p2 / p3 / p4 / p6",
   "reported_at": "2026-10-28",
   "reporter": "macm",
   "confirmed_by": "600dpi 单字裁切（俞＋刂 vs 咼）+ MinerU 独立同判"
  },
  {
   "id": "zhhant-charity-0012",
   "lang": "zh-Hant",
   "domain": "hkicharity",
   "wrong": "申請人會",
   "right": "申請入會",
   "contexts": [
    "並於申請入會時需付清入會之費用",
    "接納申請人入會後",
    "所有入會之申請人"
   ],
   "severity": "high",
   "occurrences": 6,
   "evidence": "新華中醫中藥促進會章程 p2/p9 共 6 处「申請入會時需付清入會之費用」，600dpi 裁切全部作「入」（第二笔收于左下、无捺脚）。此类之所以危险：错误形态「申請人會」在字面上可误读成「申請人＋會」，语感通顺，两个引擎都一致判「人」，只能靠原图。另九龍中醫師公會「接納申請人人會後」应为「申請人入會後」（同页对照：「人」见「申請人」，「入」见「入會」）。",
   "case_doc": "新華中醫中藥促進會有限公司 章程；九龍中醫師公會有限公司 章程",
   "case_page": "p2, p9, p10；九龍 p36",
   "reported_at": "2026-10-28",
   "reporter": "macm",
   "confirmed_by": "600dpi 裁切 + 同句内「入會之費用」的「入」作同字对照；两引擎同错，故未采信票数"
  },
  {
   "id": "zhhant-charity-0013",
   "lang": "zh-Hant",
   "domain": "hkicharity",
   "wrong": "所有人會",
   "right": "所有入會",
   "contexts": [
    "所有入會之申請人",
    "所有入會申請",
    "拒絕任何入會申請",
    "已支付的入會費",
    "成員之入會贊助"
   ],
   "severity": "high",
   "occurrences": 6,
   "evidence": "新華中醫中藥促進會 p10「所有入會之申請人」、香港中藥藥劑師協會 p19「所有入會申請」、香港廣西社團總會 p8「拒絕任何入會申請」、香港本草醫藥學會 p18「已支付的入會費」、香港華夏醫藥學會慈善基金 p4「成員之入會贊助」，均回原图核证为「入」。**修正必须等长替换（人→入）**：初稿曾在「所有人會」处插入一个「入」变成「所有人入會」，虽语义可读，但破坏与原件的字数对应，且不再是 OCR 误识性质，已回改。",
   "case_doc": "P015 中醫公會 23 份章程（新華、香港中藥藥劑師協會、香港廣西社團總會、香港本草醫藥學會、香港華夏醫藥學會慈善基金）",
   "case_page": "p4 / p8 / p10 / p18 / p19",
   "reported_at": "2026-10-28",
   "reporter": "macm",
   "confirmed_by": "600dpi 裁切 + 全文逐字长度比对（修正后与原件字数逐一相等）"
  },
  {
   "id": "zhhant-charity-0014",
   "lang": "zh-Hant",
   "domain": "hkicharity",
   "wrong": "關運",
   "right": "關連",
   "contexts": [
    "有關連的情況下",
    "與該申請有關連"
   ],
   "severity": "high",
   "occurrences": 5,
   "evidence": "董事免责条款的固定句式「在與該等行為有關連的情況下」，跨 4 份章程一致被误识：國際中醫針灸解剖學會 p18、香港中藥藥劑師協會 p17/p18、香港本草醫藥學會 p17、香港華夏醫藥學會慈善基金 p23。600dpi 裁切作「關連」（辶内为「車」，非「軍」）。關連(connected)是關連方交易的判定基准，错字直接影响条款适用。",
   "case_doc": "P015 中醫公會 23 份章程（國際中醫針灸解剖學會、香港中藥藥劑師協會、香港本草醫藥學會、香港華夏醫藥學會慈善基金）",
   "case_page": "p17 / p18 / p23",
   "reported_at": "2026-10-28",
   "reporter": "macm",
   "confirmed_by": "600dpi 裁切；同页「連」与「運」并存的段落作对照"
  },
  {
   "id": "zhhant-charity-0015",
   "lang": "zh-Hant",
   "domain": "hkicharity",
   "wrong": "價項",
   "right": "債項",
   "contexts": [
    "本公司就其債項或義務",
    "承擔該債項或義務"
   ],
   "severity": "high",
   "occurrences": 2,